{
  "schemaVersion": 1,
  "contractVersion": "1.0.0",
  "messageType": "BRAKE_HEALTH_EVENT",
  "eventId": "5d6f208d-b041-566e-b91f-c847e35667a3",
  "assessmentId": "a8ff857c-a7ca-5a59-a3fc-4e4ae90ffe3a",
  "sourceEventId": "4cba2d80-c04a-4d24-9f03-f4a85d56da13",
  "unitSystemUid": "demo-unit-validation-001",
  "unitRole": "VALIDATION",
  "serviceVersion": "2.0.0",
  "serviceArtifactSha256": "3333333333333333333333333333333333333333333333333333333333333333",
  "modelId": "brake-condition-demo-v1",
  "modelVersion": "1.0.0",
  "modelConfigSha256": "ea74cda63116d1f9fc969ec292aedb7cd0935ae899775bd8bcd73c230190e028",
  "provenance": "DEMO_SYNTHETIC",
  "content": {
    "eventType": "BRAKE_CONDITION_BAND_CHANGED",
    "reasonCode": "SYNTHETIC_ACCUMULATED_STRESS_THRESHOLD",
    "previousBand": "MONITOR",
    "currentBand": "INSPECTION_RECOMMENDED",
    "conditionScore": 38,
    "effectiveAt": "2026-08-22T12:00:07.900Z",
    "quality": "VALID_DEMO_SYNTHETIC"
  },
  "contentSha256": "df168403b59741dc61edb630312a15a658f45bd45a427c32d41f0952fc976001"
}
